question,answer
What does organic mean?,Organic products are produced without synthetic pesticides, GMOs, artificial hormones, or antibiotics. They're grown or raised using natural and sustainable methods.
How do I know if a product is certified organic?,Look for official certification marks from organizations like USDA (USA), ECOCERT, or your local organic certification body. These ensure strict compliance with organic standards.
Is organic food worth the higher price?,While organic can cost more upfront, many people find value in reduced pesticide exposure, better taste, higher nutrient levels, and supporting sustainable farming practices.
Where can I find seasonal organic produce?,Check local farmers markets, community supported agriculture (CSA) programs, organic grocery stores, or look for seasonal sections in regular supermarkets.
How should I store organic produce to keep it fresh?,Organic produce has no synthetic preservatives, so store it properly: leafy greens in the crisper, berries in the coldest part, and roots in a cool dark place. Use within a few days for best results.
Are organic dairy products better than conventional?,Organic dairy comes from cows not treated with hormones or antibiotics and fed organic feed. Many prefer the taste and see it as a healthier option, especially for families.
Can I afford to buy all organic?,Start by buying organic for the "Dirty Dozen" (most pesticide-heavy produce), then gradually expand as your budget allows. Every organic purchase supports sustainable farming.
How do I transition to an organic lifestyle?,Begin with one category (like produce or dairy), learn about seasonal options, explore local farmers markets, and gradually incorporate more organic products into your routine.
Are organic frozen vegetables as nutritious as fresh?,Yes! Frozen organic vegetables are often picked at peak ripeness and frozen immediately, locking in nutrients. They're convenient and often more affordable.
What certifications should I look for?,USDA Organic, ECOCERT, Demeter (biodynamic), Fair Trade, Rainforest Alliance, and local organic certification bodies are all credible standards worth looking for.
