text,link_url,start_date,end_date,sort_order,status
"New Project Launch: Whitefield Heights - 2 & 3 BHK starting ₹72L. Register now!","/services/property-search","2025-01-01","2025-12-31",1,active
"Limited Time: Zero processing fee on home loans this month. Talk to our advisors.","/contact","2025-05-01","2025-05-31",2,active
"Advith Homes now serves Hyderabad & Pune - explore properties today!","/services","","",3,active
"Free legal consultation for first-time home buyers. Book your slot.","/contact","","",4,active
"Mid-Year Market Report 2025 is live - download your free copy.","/blog/bengaluru-real-estate-mid-year-2025","2025-07-01","2025-09-30",5,active
