question,answer,topic_slug,sort_order,status
How do I prepare for my operation?,You will receive a pre-admission letter with specific instructions. Generally you should fast (no food or drink) for at least 6 hours before a general anaesthetic. Tell your surgeon about all medications — some need to be stopped before surgery. Remove nail varnish and do not apply creams or lotions.,pre-surgery,1,active
Can I drive myself home after day surgery?,"No. You must arrange for a responsible adult to drive you home and stay with you for at least 24 hours after a general anaesthetic. Taxis and public transport are not suitable. If you cannot arrange this, please tell your surgical team as soon as possible.",day-surgery,2,active
How long will I need to recover at home after surgery?,"Recovery time depends on the type of surgery. Many day procedures allow return to light activities within a few days, while major surgery may require several weeks. Your surgical team will give you specific advice and a written information leaflet before you go home.",post-surgery,3,active
What should I do if I have chest pain at home after a cardiac procedure?,Dial 999 immediately. Chest pain after a cardiac procedure is a medical emergency. Do not drive yourself to hospital — call 999 and tell the operator you have recently had a cardiac procedure.,cardiac-procedures,4,active
How soon can I drive after a hip or knee replacement?,"Most people can return to driving 6 weeks after a total hip or knee replacement, provided they can perform an emergency stop safely. You must not drive while taking strong pain medication. Check with your surgeon at your follow-up appointment before returning to driving.",knee-hip,5,active
When will I get my outpatient appointment?,Most outpatient appointment letters are sent by post within 4 weeks of your GP referral. You can also check via the NHS App or Patient Portal. If you haven't heard within 6 weeks please contact the relevant department directly.,your-appointment,6,active
What happens at my antenatal appointments?,"Routine antenatal appointments include measuring your blood pressure, testing your urine, discussing any concerns, and listening to your baby's heartbeat. At specific appointments you'll also have blood tests and ultrasound scans. Your midwife will explain what to expect at each stage.",antenatal,7,active
Can I have a family member with me during procedures?,A support person is welcome for most procedures. For certain procedures in theatre or investigations you may need to wait in the department waiting area. Staff will let you know what is possible for your specific procedure.,your-appointment,8,active
