type,src,poster,avatar,channel,handle,title,desc
youtube,https://youtu.be/dQw4w9WgXcQ,https://images.unsplash.com/photo-1529626455594-4ff0802cfb7e?auto=format&fit=crop&w=480&h=854&q=80,https://images.unsplash.com/photo-1494790108377-be9c29b29330?auto=format&fit=crop&w=80&h=80&q=80,Priya — Wedding Host,The Cane House,Best Drink at Our Mehndi Night!,Guests couldn't stop talking about the fresh-pressed cane juice.
youtube,https://youtu.be/aqz-KE-bpKQ,https://images.unsplash.com/photo-1507003211169-0a1dd7228f2d?auto=format&fit=crop&w=480&h=854&q=80,https://images.unsplash.com/photo-1500648767791-00dcc994a43e?auto=format&fit=crop&w=80&h=80&q=80,Aman — Corporate Event,The Cane House,Our Office Loved the Live Stall,The live pressing was the highlight of our summer party.
youtube,https://youtu.be/9bZkp7q19f0,https://images.unsplash.com/photo-1438761681033-6461ffad8d80?auto=format&fit=crop&w=480&h=854&q=80,https://images.unsplash.com/photo-1544005313-94ddf0286df2?auto=format&fit=crop&w=80&h=80&q=80,Sara — Birthday Party,The Cane House,A Refreshing Surprise for Kids,Healthier than fizzy drinks and the children adored it.
youtube,https://youtu.be/3JZ_D3ELwOQ,https://images.unsplash.com/photo-1521146764736-56c929d59c83?auto=format&fit=crop&w=480&h=854&q=80,https://images.unsplash.com/photo-1607746882042-944635dfe10e?auto=format&fit=crop&w=80&h=80&q=80,Dev — Diwali Function,The Cane House,Tradition in Every Glass,Brought a taste of home to our festival celebration.
youtube,https://youtu.be/L_jWHffIx5E,https://images.unsplash.com/photo-1519085360753-af0119f7cbe7?auto=format&fit=crop&w=480&h=854&q=80,https://images.unsplash.com/photo-1633332755192-727a05c4013d?auto=format&fit=crop&w=80&h=80&q=80,Meera — Eid Gathering,The Cane House,Fresh Juice Stole the Show,Everyone asked where we found such an amazing stall.
youtube,https://youtu.be/fJ9rUzIMcZQ,https://images.unsplash.com/photo-1502685104226-ee32379fefbe?auto=format&fit=crop&w=480&h=854&q=80,https://images.unsplash.com/photo-1539571696357-5a69c17a67c6?auto=format&fit=crop&w=80&h=80&q=80,Rohan — Franchise Partner,The Cane House,Why I Joined The Cane House,Best decision I made - the brand sells itself.
